{
  "book": "quantum-universe",
  "slug": "ch15",
  "order": 15,
  "thaiNum": "๑๕",
  "title": "จิตรู้สำนึกแห่งจักรวาล",
  "sub": "Panpsychism กลับมาอีกครั้ง · ดาวฤกษ์ที่อาจเลือกทางของตัวเอง · และหมึกยักษ์ที่หนวดแต่ละเส้นคิดเองได้",
  "status": "ready",
  "goal": "จบบทนี้ คุณจะรู้ว่า Panpsychism เสนออะไร ทำไมมันถึงกลับมาอยู่ในวงถกเถียงทางวิชาการอีกครั้ง มีใครพยายามทดสอบมันอย่างไรบ้าง และที่สำคัญคือเส้นแบ่งระหว่างข้อเสนอที่ทดสอบได้กับการคาดเดาอยู่ตรงไหน",
  "summary": "บทนี้พาไปดูแนวคิด Panpsychism ที่ถือว่าทุกสิ่งในธรรมชาติมีการรับรู้อยู่ในตัวไม่มากก็น้อย ตั้งแต่รากกรีกโบราณ การกลับมาในศตวรรษที่ 21 คำอธิบายว่าทำไมก้อนหินถึงต่างจากสิ่งมีชีวิต งานของแมตลอฟฟ์ที่พยายามทดสอบแนวคิดนี้กับการโคจรของดาวฤกษ์ และงานของคอชที่วัดจิตรู้สำนึกด้วยความซับซ้อนของการเชื่อมโยงข้อมูล",
  "keyPoints": [
    "Panpsychism คือจุดยืนที่ว่าทุกสิ่งในธรรมชาติมีการรับรู้อยู่ในตัวเป็นระดับ มีรากมาตั้งแต่ยุคกรีกโบราณพร้อมกับแนวคิดเรื่องอะตอม",
    "ฝ่ายนี้ยืนยันว่าจิตรู้สำนึกที่ลอยอยู่โดดๆ ไม่มี มันต้องผูกกับสิ่งทางกายภาพเสมอ เหมือนสองด้านของเหรียญเดียวกัน",
    "ความต่างระหว่างก้อนหินกับสิ่งมีชีวิตอยู่ที่การเชื่อมต่อ สิ่งมีชีวิตมีเส้นทางไฟฟ้าเคมีที่ทำให้ข้อมูลไหลถึงกันทั้งระบบ ส่วนก้อนหินเป็นเพียงมวลสารที่มารวมกัน",
    "งานที่หนังสืออ้างจาก UCLA เสนอว่าจิตระดับใหญ่เกิดจากการสั่นพ้องร่วมกันของหน่วยย่อยจำนวนมาก และความเร็วของคลื่นสั่นพ้องกำหนดขนาดของจิตแต่ละดวง",
    "เกร็กกอรี่ แมตลอฟฟ์เสนอในปี 2016 ว่ามีสนามจิตรู้สำนึกพื้นฐานแผ่ทั่วจักรวาล หนังสือเล่าต่อถึงข้อเสนอเรื่องสุญญากาศควอนตัมของแบร์นาร์ด ไฮช์เมื่อปี 2006 ด้วย",
    "แมตลอฟฟ์ยอมรับว่าเป็นการคาดเดาและพยายามหาข้อมูลมาตรวจ แต่การทดสอบที่เขาเสนอยังแยกไม่ขาดระหว่างเจตนาของดาวกับกลไกทางกายภาพอย่างไอพ่น",
    "คริสตอฟ คอชใช้ทฤษฎีข้อมูลแบบบูรณาการวัดจิตรู้สำนึกที่ความซับซ้อนของการเชื่อมโยงภายใน ไม่ใช่ที่ขนาดหรือที่ว่ามีชีวิตหรือไม่",
    "บทนี้จบลงที่สถานะของคำถาม ไม่ใช่คำตอบ Panpsychism มีผู้สนับสนุนที่น่านับถือและมีคนพยายามทดสอบ แต่ยังไม่มีข้อสรุปใดที่ยืนยันได้"
  ],
  "keywords": [
    "Panpsychism",
    "จิตรู้สำนึกพื้นฐาน",
    "เกร็กกอรี่ แมตลอฟฟ์",
    "คริสตอฟ คอช",
    "เดวิด ชาลเมอร์ส",
    "ทฤษฎีข้อมูลแบบบูรณาการ",
    "สุญญากาศควอนตัม",
    "การสั่นพ้อง",
    "หมึกยักษ์",
    "ความซับซ้อน"
  ],
  "sections": [
    {
      "h2": "แนวคิดเก่าแก่ที่กลับมาอยู่บนโต๊ะอีกครั้ง",
      "paragraphs": [
        "นักฟิสิกส์ยุคใหม่บางคนตั้งคำถามที่ฟังดูแปลกตั้งแต่ประโยคแรก คือวัตถุธรรมดาทั่วไปในจักรวาลมี<dfn data-term=\"จิตรู้สำนึก\" data-kind=\"วิทยาศาสตร์\">จิตรู้สำนึก</dfn>อยู่ด้วยหรือเปล่า ความคิดที่ให้ทุกสิ่งในธรรมชาติมีส่วนของจิตอยู่นั้นไม่ใช่ของใหม่ มันมีมาตั้งแต่ยุคกรีกโบราณ พร้อมๆ กับแนวคิดเรื่อง<dfn data-term=\"อะตอม\" data-kind=\"วิทยาศาสตร์\">อะตอม</dfn> และมีชื่อเรียกว่า <dfn data-term=\"Panpsychism\" data-kind=\"ปรัชญา\">Panpsychism</dfn>",
        "แนวคิดนี้เลือนหายไปเมื่อวิทยาศาสตร์สมัยใหม่รุ่งเรืองขึ้น แต่พอเข้าศตวรรษที่ 21 มันกลับมาอยู่ในวงสนทนาทางปรัชญาอีกครั้ง คราวนี้มีนักคิดและนักวิทยาศาสตร์ระดับแนวหน้าร่วมถกเถียงด้วย และมีความพยายามจะตรวจสอบมันด้วยวิธีการทางวิทยาศาสตร์",
        "ข้อเสนอของฝ่ายนี้ไม่ซับซ้อนอย่างที่คิด พวกเขาไม่ได้บอกว่า<dfn data-term=\"อิเล็กตรอน\" data-kind=\"วิทยาศาสตร์\">อิเล็กตรอน</dfn>นั่งคิดเลข แต่บอกว่าการรับรู้มีอยู่เป็นระดับ อิเล็กตรอนหรืออะตอมมีในระดับต่ำมากจนแทบไม่มีความหมาย ส่วนจิตของมนุษย์อยู่ที่ปลายอีกด้านของสเกลเดียวกัน ความต่างระหว่างเรากับอิเล็กตรอนหนึ่งตัวจึงเป็นเรื่องของระดับ ไม่ใช่เรื่องของชนิด",
        "อีกข้อที่ฝ่ายนี้ยืนยันคือจิตรู้สำนึกที่ลอยอยู่โดดๆ ไม่มีอยู่ มันต้องผูกกับสิ่งทางกายภาพเสมอ เหมือนสองด้านของเหรียญเดียวกัน ตรงนี้ทำให้ Panpsychism ต่างจากความเชื่อเรื่องวิญญาณที่แยกออกจากร่างได้"
      ]
    },
    {
      "h2": "ทำไมก้อนหินถึงไม่คิด",
      "paragraphs": [
        "คำถามที่ตามมาทันทีคือ ถ้าทุกอย่างมีการรับรู้ในระดับหนึ่ง ทำไมก้อนหินถึงไม่คิด คำตอบที่ฝ่ายนี้ให้คือเรื่องการเชื่อมต่อ สิ่งมีชีวิตอาศัยเส้นทางไฟฟ้าเคมีที่ทำให้ข้อมูลไหลเวียนเร็วและเชื่อมถึงกันทั่วทั้งระบบ ส่วนก้อนหินกับกองทรายเป็นเพียงการรวมกันของมวลสารที่มากขึ้น หน่วยย่อยแต่ละหน่วยไม่ได้คุยกัน",
        "หนังสือยกงานจากมหาวิทยาลัยแคลิฟอร์เนีย ลอสแอนเจลิส ที่เสนอว่า<dfn data-term=\"จิตรู้สำนึก\" data-kind=\"วิทยาศาสตร์\">จิตรู้สำนึก</dfn>ระดับใหญ่เกิดจาก<dfn data-term=\"การสั่นพ้อง\" data-kind=\"วิทยาศาสตร์\">การสั่นพ้อง</dfn>ร่วมกันระหว่างองค์ประกอบระดับเล็กจำนวนมาก และความเร็วของคลื่นสั่นพ้องที่มีอยู่เป็นตัวกำหนดขนาดของจิตแต่ละดวง พูดอีกอย่างคือกลไกการซิงค์คือกุญแจที่ทำให้การรับรู้ขยายจากระดับพื้นฐานขึ้นมาเป็นระดับที่เรารู้จัก",
        "หนังสือชี้ว่าเมื่อมองแบบนี้ ข้อเสนอของเพนโรสกับฮาเมรอฟฟ์ก็เข้ากันได้ เพราะพวกเขาบอกว่าเหตุการณ์ที่ทำให้เกิดจิตรู้สำนึกมีอยู่ทั่วจักรวาลอยู่แล้ว การที่มันมารวมตัวกันจนเกิดเป็นจิตแบบมนุษย์ใน<dfn data-term=\"เซลล์ประสาท\" data-kind=\"วิทยาศาสตร์\">เซลล์ประสาท</dfn>สมอง จึงไม่ใช่เรื่องพิเศษเหนือธรรมชาติ แต่เป็นผลของโครงสร้างที่ซับซ้อนพอ",
        "ผู้เขียนทิ้งคำถามไว้ให้เราถือติดมือไปจนถึงบทที่ ๑๘ สนามข้อมูลของ<dfn data-term=\"กรรม\" data-kind=\"ธรรมะ\">กรรม</dfn> ที่หนังสือกลับมาพูดเรื่องการจัดระเบียบตัวเองของสิ่งมีชีวิตอีกครั้ง คำถามนั้นคือ แล้วคำสั่งอะไรที่ทำให้อนุภาคจัดระเบียบตัวเองจนรวมกันเป็นสิ่งมีชีวิตและเกิดเป็นจิตรู้สำนึกขึ้นมา นี่คือคำถามที่ยังไม่มีใครในวงการตอบได้ครบ ไม่ใช่เฉพาะในหนังสือเล่มนี้"
      ]
    },
    {
      "h2": "ชายที่ไปหาคำตอบจากดวงดาว",
      "paragraphs": [
        "ในปี 2016 เกร็กกอรี่ แมตลอฟฟ์ นักฟิสิกส์แห่งวิทยาลัยเทคโนโลยีนิวยอร์กซิตี้ ตีพิมพ์งานที่เสนอว่ามนุษย์อาจเป็นส่วนหนึ่งของจักรวาลทั้งในด้าน<dfn data-term=\"สสาร\" data-kind=\"วิทยาศาสตร์\">สสาร</dfn>และด้านจิต โดยมีสิ่งที่เขาเรียกว่าสนาม<dfn data-term=\"จิตรู้สำนึกพื้นฐาน\" data-kind=\"ปรัชญา\">จิตรู้สำนึกพื้นฐาน</dfn>แผ่อยู่ทั่วทุกพื้นที่ หนังสือเล่าต่อถึงข้อเสนอของแบร์นาร์ด ไฮช์ในปี 2006 ที่ว่า<dfn data-term=\"สุญญากาศควอนตัม\" data-kind=\"วิทยาศาสตร์\">สุญญากาศควอนตัม</dfn>ซึ่งซึมอยู่ทั่วที่ว่าง เป็นตัวผลิตและส่งผ่าน<dfn data-term=\"จิตรู้สำนึก\" data-kind=\"วิทยาศาสตร์\">จิตรู้สำนึก</dfn>ไปปรากฏในระบบที่ซับซ้อนพอและมี<dfn data-term=\"พลังงาน\" data-kind=\"วิทยาศาสตร์\">พลังงาน</dfn>ไหลผ่าน",
        "สิ่งที่ทำให้งานของแมตลอฟฟ์ถูกพูดถึงคือเขาพยายามหาวิธีทดสอบ เขาไปจับความผิดปกติในการเคลื่อนที่ของดาวฤกษ์ที่เรียกว่า Paranego's Discontinuity ซึ่งพบว่าโดยเฉลี่ยดาวที่เย็นกว่าโคจรรอบกาแล็กซีเร็วกว่าดาวที่ร้อนกว่า นักดาราศาสตร์ส่วนใหญ่อธิบายว่าเป็นผลจากปฏิสัมพันธ์ระหว่างดาวกับเมฆแก๊ส แต่แมตลอฟฟ์ตั้งข้อสังเกตว่าดาวที่แสดงความผิดปกตินี้เย็นพอจะมี<dfn data-term=\"โมเลกุล\" data-kind=\"วิทยาศาสตร์\">โมเลกุล</dfn>ในชั้นบรรยากาศจำนวนมาก และบางดวงพ่นไอพ่นไปทางเดียวกันจนอาจเปลี่ยนการเคลื่อนที่ของตัวเองได้",
        "เขาจึงเสนอวิธีแยกสองคำอธิบายออกจากกัน ถ้าปรากฏการณ์นี้เกิดจากสภาพเฉพาะที่ในกาแล็กซี มันควรต่างกันไปตามตำแหน่ง แต่ถ้ามันมาจากสิ่งที่อยู่ในตัวดาวเอง มันควรเหมือนกันทุกที่ และเขาอ่านข้อมูลเท่าที่มีว่าดูจะไปทางหลัง ตรงนี้ต้องพูดให้ชัดว่าข้อเสนอที่ว่าดาวฤกษ์อาจกำลังบังคับเส้นทางของตัวเองอย่างจงใจ เป็นการคาดเดาที่ยังไม่มีฉันทามติรองรับ และแมตลอฟฟ์เองก็พูดแบบนั้น",
        "จุดที่ควรชื่นชมในงานนี้จึงไม่ใช่ข้อสรุป แต่เป็นท่าที เขายอมรับว่าทั้งหมดเป็นการคาดเดาอย่างมาก แล้วพยายามหาข้อมูลมาตรวจ ซึ่งเป็นทิศทางที่ถูกของวิทยาศาสตร์ แต่การทดสอบที่เขาเสนอยังแยกไม่ขาด ถ้าผลออกมาเหมือนกันทุกที่ ก็บอกได้แค่ว่าสาเหตุอยู่ในตัวดาว ซึ่งอาจเป็นกลไกทางกายภาพอย่างไอพ่นที่เขาเองก็ยกมา ไม่จำเป็นต้องเป็นเจตนาของดาว"
      ],
      "callout": {
        "label": "ย่อหน้าเรื่องไวรัสที่ควรอ่านอย่างระวังเป็นพิเศษ",
        "text": "หนังสือมีท่อนหนึ่งที่ถามว่าถ้าจักรวาลมีจิตรู้สำนึก ไวรัสก็ต้องมีด้วย แล้วเสนอว่าการเปลี่ยนแปลงรหัสพันธุกรรมของไวรัสอาจเป็นเจตนา และเครือข่ายของพวกมันอาจกำลังตอบสนองต่ออุณหภูมิโลกที่สูงขึ้น ตรงนี้ต้องแยกให้ขาด สิ่งที่ชีววิทยารู้แน่คือ<dfn data-term=\"การกลายพันธุ์\" data-kind=\"วิทยาศาสตร์\">การกลายพันธุ์</dfn>ของไวรัสเกิดขึ้นแบบสุ่ม แล้วสายพันธุ์ที่บังเอิญเหมาะกับสภาพแวดล้อมก็อยู่รอดและแพร่ต่อ กระบวนการนี้ดูเหมือนมีเป้าหมายเมื่อมองย้อนหลัง แต่ไม่ต้องอาศัยเจตนาใดเลยในการอธิบาย การอ่านว่าไวรัสตั้งใจสู้กับมนุษย์จึงเป็นการตีความของผู้เขียน ไม่ใช่ข้อค้นพบ"
      }
    },
    {
      "h2": "อีกฝั่งหนึ่ง ที่วัดกันด้วยความซับซ้อน",
      "paragraphs": [
        "อีกฝั่งหนึ่ง คริสตอฟ คอช นักประสาทวิทยาจากสถาบันอัลเลน เลือกมองเข้าหามนุษย์แทนที่จะมองออกไปที่ดวงดาว เขาทำงานบน<dfn data-term=\"ทฤษฎีข้อมูลแบบบูรณาการ\" data-kind=\"วิทยาศาสตร์\">ทฤษฎีข้อมูลแบบบูรณาการ</dfn> ซึ่งถือว่าระดับของ<dfn data-term=\"จิตรู้สำนึก\" data-kind=\"วิทยาศาสตร์\">จิตรู้สำนึก</dfn>ขึ้นกับความสามารถของระบบที่จะรับอิทธิพลจากสถานะก่อนหน้าและส่งอิทธิพลไปยังสถานะถัดไป พูดง่ายๆ คือวัดกันที่ความเชื่อมโยงภายใน ไม่ใช่ที่ขนาด",
        "การทดลองที่กลุ่มของเขาวางไว้มีทั้งการศึกษาผู้ป่วยที่มีความบกพร่องทางสมอง เพื่อดูว่าการตอบสนองต่อข้อมูลสอดคล้องกับระดับการรู้ตัวหรือไม่ และการทดลองเชื่อมสมองหนูสองตัวเข้าด้วยกันเพื่อดูว่าเมื่อข้อมูลไหลถึงกันมากขึ้น ทั้งคู่จะรวมเป็นระบบเดียวที่ใหญ่กว่าหรือไม่",
        "ข้อสรุปของคอชน่าสนใจตรงที่มันไม่ได้อยู่ที่เส้นแบ่งระหว่างมีชีวิตกับไม่มีชีวิต แต่อยู่ที่ความซับซ้อน ดวงอาทิตย์ใหญ่กว่าแบคทีเรียมหาศาล แต่ในทางคณิตศาสตร์มันเรียบง่ายกว่ามาก ความรู้สึกของการเป็นดาวฤกษ์จึงน้อยกว่าความรู้สึกของการเป็นแบคทีเรียเสียอีก หนังสือยังชวนให้นึกถึงหมึกยักษ์ที่มี<dfn data-term=\"เซลล์ประสาท\" data-kind=\"วิทยาศาสตร์\">เซลล์ประสาท</dfn>กระจายอยู่ตามหนวด จนแต่ละหนวดคิดเองได้โดยไม่ต้องรอคำสั่งจากส่วนกลาง แล้วถามว่าจิตของสัตว์แบบนั้นจะเป็นอย่างไร",
        "สิ่งที่ควรติดตัวจากบทนี้จึงไม่ใช่คำตอบ แต่เป็นสถานะของคำถาม <dfn data-term=\"Panpsychism\" data-kind=\"ปรัชญา\">Panpsychism</dfn> กลับมาอยู่ในวงถกเถียงอย่างจริงจังอีกครั้ง มีผู้สนับสนุนที่น่านับถือทั้งในปรัชญาอย่างเดวิด ชาลเมอร์ส และในประสาทวิทยาอย่างคอช และมีคนพยายามหาวิธีทดสอบมันจริงๆ แต่ยังไม่มีข้อสรุป การรู้ว่าเรื่องนี้อยู่ตรงไหนของเส้นทาง สำคัญกว่าการรีบเลือกข้าง"
      ]
    }
  ],
  "interactive": {
    "module": "particles",
    "position": 2,
    "title": "ถ้าทุกสิ่งมีการรับรู้เป็นระดับ แต่ละสิ่งอยู่ตรงไหน",
    "intro": "เลือกสิ่งหนึ่งอย่าง แล้วเลื่อนแถบ \"ความซับซ้อนของการเชื่อมโยง\" ดูมันตั้งแต่หน่วยย่อยที่ยังไม่คุยกัน ไปจนถึงระบบที่ข้อมูลไหลถึงกันทั้งหมด จากนั้นกดแว่นแต่ละอันเพื่ออ่านว่าแนวคิดหลักสามข้อของเล่มนี้มองสิ่งนั้นอย่างไร ข้อควรระวัง: การจัดลำดับนี้ใช้กรอบของ Panpsychism ซึ่งเป็นข้อเสนอทางปรัชญา ไม่ใช่มาตรวัดที่วิทยาศาสตร์ยืนยันแล้ว",
    "config": {
      "lensLabels": [
        {